{
  "schemaVersion": 1,
  "packageId": "round15-audio",
  "candidate_only": true,
  "humanListeningReview": false,
  "rightsClearance": "not_granted",
  "counts": { "music": 7, "ambience": 6, "sfx": 8, "total": 21 },
  "candidates": [
    { "stableId": "music-corporate-soft-pressure", "kind": "music", "function": "企业温柔压迫", "sequenceMapping": ["SQ01"], "file": "audio/music/music-corporate-soft-pressure.mp3", "provenance": { "sourceRecordId": "source-music-corporate-soft-pressure", "provider": "Incompetech", "itemUrl": "https://incompetech.com/music/royalty-free/index.html?isrc=USUAN1300012", "sourcePath": "Local Forecast - Elevator.mp3", "claimedLicense": "Creative Commons Attribution 4.0", "sourceSha256": "8c46b44e65324bc339fbbc3e770611d671f6c74a40f3ec8dd50332c082b25cc9" }, "transformation": "trim start=15s window=46s; 1s boundary crossfade; EBU R128 target -22 LUFS; 44100 Hz stereo 128 kbps MP3", "technical": { "codec": "mp3", "sampleRate": 44100, "channels": 2, "durationSeconds": 45.0, "integratedLufs": -21.1, "truePeakDbtp": -2.3, "bytes": 721022, "sha256": "a32a0197523a1d6962dcb12e9eaef971a7ca724aa165fbfc39dec3704368191b" }, "loopCandidate": true, "candidate_only": true, "humanListeningReview": false, "rightsClearance": "not_granted" },
    { "stableId": "music-private-shame-fracture", "kind": "music", "function": "私人羞耻裂缝", "sequenceMapping": ["SQ02", "SQ03"], "file": "audio/music/music-private-shame-fracture.mp3", "provenance": { "sourceRecordId": "source-music-private-shame-fracture", "provider": "Incompetech", "itemUrl": "https://incompetech.com/music/royalty-free/index.html?isrc=USUAN2000011", "sourcePath": "SCP-x5x.mp3", "claimedLicense": "Creative Commons Attribution 4.0", "sourceSha256": "cb346a34d4e074e469b41dff74acc0bd275a77d1be592e4fb8fc6b48eed1657c" }, "transformation": "trim start=20s window=46s; 1s boundary crossfade; EBU R128 target -22 LUFS; 44100 Hz stereo 128 kbps MP3", "technical": { "codec": "mp3", "sampleRate": 44100, "channels": 2, "durationSeconds": 45.0, "integratedLufs": -21.8, "truePeakDbtp": -2.6, "bytes": 721022, "sha256": "708b7bd644065daf430d90b2cd428a0681fdad12b12b565d42cec598aa9df576" }, "loopCandidate": true, "candidate_only": true, "humanListeningReview": false, "rightsClearance": "not_granted" },
    { "stableId": "music-public-spectacle-payment", "kind": "music", "function": "公开围观与到账", "sequenceMapping": ["SQ04", "SQ05", "SQ06"], "file": "audio/music/music-public-spectacle-payment.mp3", "provenance": { "sourceRecordId": "source-music-public-spectacle-payment", "provider": "Incompetech", "itemUrl": "https://incompetech.com/music/royalty-free/index.html?isrc=USUAN1900009", "sourcePath": "Half Mystery.mp3", "claimedLicense": "Creative Commons Attribution 4.0", "sourceSha256": "38eb3ed04e3e6ff2f3cbdb2dfb448d4b603da34ab6b016e39c0f36a9f286b2e7" }, "transformation": "trim start=30s window=46s; 1s boundary crossfade; EBU R128 target -22 LUFS; 44100 Hz stereo 128 kbps MP3", "technical": { "codec": "mp3", "sampleRate": 44100, "channels": 2, "durationSeconds": 45.0, "integratedLufs": -22.4, "truePeakDbtp": -8.9, "bytes": 721022, "sha256": "cd432e2313fe071bf5acf60ebc0ea5359af1084ac75ad76bf6005c44857d0927" }, "loopCandidate": true, "candidate_only": true, "humanListeningReview": false, "rightsClearance": "not_granted" },
    { "stableId": "music-night-alley-alliance", "kind": "music", "function": "夜巷笨拙同盟", "sequenceMapping": ["SQ07", "SQ09"], "file": "audio/music/music-night-alley-alliance.mp3", "provenance": { "sourceRecordId": "source-music-night-alley-alliance", "provider": "Incompetech", "itemUrl": "https://incompetech.com/music/royalty-free/index.html?isrc=USUAN2100002", "sourcePath": "Ethernight Club.mp3", "claimedLicense": "Creative Commons Attribution 4.0", "sourceSha256": "40c13873da38bff6da4e1e8d7e2907e05d4c308d25707aa707f3032bffe74064" }, "transformation": "trim start=24s window=46s; 1s boundary crossfade; EBU R128 target -22 LUFS; 44100 Hz stereo 128 kbps MP3", "technical": { "codec": "mp3", "sampleRate": 44100, "channels": 2, "durationSeconds": 45.0, "integratedLufs": -22.2, "truePeakDbtp": -7.8, "bytes": 721022, "sha256": "25c22ae2868e90674526cb67bbe5fb59f1d5235264c8bf01f13b75347e8c4a84" }, "loopCandidate": true, "candidate_only": true, "humanListeningReview": false, "rightsClearance": "not_granted" },
    { "stableId": "music-budget-settling", "kind": "music", "function": "廉价安顿", "sequenceMapping": ["SQ08", "SQ10"], "file": "audio/music/music-budget-settling.mp3", "provenance": { "sourceRecordId": "source-music-budget-settling", "provider": "Incompetech", "itemUrl": "https://incompetech.com/music/royalty-free/index.html?isrc=USUAN1500047", "sourcePath": "Ossuary 5 - Rest.mp3", "claimedLicense": "Creative Commons Attribution 4.0", "sourceSha256": "895d3f3ef3be3a1da4b4198a6c131b55fb87176f43bcaf7e104d320a3dee3bd4" }, "transformation": "trim start=15s window=46s; 1s boundary crossfade; EBU R128 target -22 LUFS; 44100 Hz stereo 128 kbps MP3", "technical": { "codec": "mp3", "sampleRate": 44100, "channels": 2, "durationSeconds": 45.0, "integratedLufs": -21.2, "truePeakDbtp": -6.3, "bytes": 721022, "sha256": "b64bff451329106b04e6958061c51008315ca48408fcb0a5228ef829963319a5" }, "loopCandidate": true, "candidate_only": true, "humanListeningReview": false, "rightsClearance": "not_granted" },
    { "stableId": "music-robot-temptation", "kind": "music", "function": "机器人诱惑", "sequenceMapping": ["SQ11", "SQ12"], "file": "audio/music/music-robot-temptation.mp3", "provenance": { "sourceRecordId": "source-music-robot-temptation", "provider": "Incompetech", "itemUrl": "https://incompetech.com/music/royalty-free/index.html?isrc=USUAN1600013", "sourcePath": "Crypto.mp3", "claimedLicense": "Creative Commons Attribution 4.0", "sourceSha256": "f09ba8bff00baca85fcdcde3b7f5d6b34a09c2c0b44b007a9123ee42f7d1bcf2" }, "transformation": "trim start=20s window=46s; 1s boundary crossfade; EBU R128 target -22 LUFS; 44100 Hz stereo 128 kbps MP3", "technical": { "codec": "mp3", "sampleRate": 44100, "channels": 2, "durationSeconds": 45.0, "integratedLufs": -22.5, "truePeakDbtp": -10.4, "bytes": 721022, "sha256": "98d7ea47998355c0e7e9a65c68c89f2b97f8c17a955faa136fd6fd44b382c3c8" }, "loopCandidate": true, "candidate_only": true, "humanListeningReview": false, "rightsClearance": "not_granted" },
    { "stableId": "music-chapter-endpoint", "kind": "music", "function": "章节终点", "sequenceMapping": ["SQ13"], "file": "audio/music/music-chapter-endpoint.mp3", "provenance": { "sourceRecordId": "source-music-chapter-endpoint", "provider": "Incompetech", "itemUrl": "https://incompetech.com/music/royalty-free/index.html?isrc=USUAN1500049", "sourcePath": "Ossuary 7 - Resolve.mp3", "claimedLicense": "Creative Commons Attribution 4.0", "sourceSha256": "73e6b892a4b13749dd8888cf5a03b5236e92d47bc791723d884c7479bf7c6789" }, "transformation": "trim start=20s window=46s; 1s boundary crossfade; EBU R128 target -22 LUFS; 44100 Hz stereo 128 kbps MP3", "technical": { "codec": "mp3", "sampleRate": 44100, "channels": 2, "durationSeconds": 45.0, "integratedLufs": -22.6, "truePeakDbtp": -9.6, "bytes": 721022, "sha256": "23b2a9640d8db8150f6a8d0c4bd2958f9f67760ac5a78d379695240f161eb9e8" }, "loopCandidate": true, "candidate_only": true, "humanListeningReview": false, "rightsClearance": "not_granted" },
    { "stableId": "test-booth-hvac", "kind": "ambience", "function": "测试间空调与近场房间底噪", "sequenceMapping": ["SQ01", "SQ02", "SQ03", "SQ04"], "file": "audio/ambience/test-booth-hvac.mp3", "provenance": { "sourceRecordId": "source-test-booth-hvac", "provider": "Freesound", "itemUrl": "https://freesound.org/people/Sauron974/sounds/273627/", "sourcePath": "previews/273/273627_152878-lq.mp3", "claimedLicense": "Creative Commons 0", "sourceSha256": "825c1a91315a23fb452bea3608fa6f9278e6423525ebca0c44e447b65b12744f" }, "transformation": "trim start=10s window=31s; 1s boundary crossfade; EBU R128 target -26 LUFS; 44100 Hz stereo 112 kbps MP3", "technical": { "codec": "mp3", "sampleRate": 44100, "channels": 2, "durationSeconds": 30.0, "integratedLufs": -26.5, "truePeakDbtp": -13.7, "bytes": 420980, "sha256": "62ede3ab02c378bafede8f66e81f03888560b80c8c8a62a9085bf7efeff32401" }, "loopCandidate": true, "candidate_only": true, "humanListeningReview": false, "rightsClearance": "not_granted" },
    { "stableId": "office-corridor", "kind": "ambience", "function": "办公走廊空场与通风底噪", "sequenceMapping": ["SQ02", "SQ04", "SQ05", "SQ06"], "file": "audio/ambience/office-corridor.mp3", "provenance": { "sourceRecordId": "source-office-corridor", "provider": "Freesound", "itemUrl": "https://freesound.org/people/Sheyvan/sounds/570015/", "sourcePath": "previews/570/570015_3248005-lq.mp3", "claimedLicense": "Creative Commons 0", "sourceSha256": "03487198784139420285a0990f49310da8eb0ec11b928e64a7185ca1da484624" }, "transformation": "trim start=5s window=31s; 1s boundary crossfade; EBU R128 target -26 LUFS; 44100 Hz stereo 112 kbps MP3", "technical": { "codec": "mp3", "sampleRate": 44100, "channels": 2, "durationSeconds": 30.0, "integratedLufs": -26.7, "truePeakDbtp": -13.6, "bytes": 420980, "sha256": "1a7577859302e8e1a8cdc7702d64222e58f460e8e076682d746bbe0376739a04" }, "loopCandidate": true, "candidate_only": true, "humanListeningReview": false, "rightsClearance": "not_granted" },